{
  "schema_version": 1,
  "runtime_id": "22222222-2222-4222-8222-222222222222",
  "session_id": "33333333-3333-4333-8333-333333333333",
  "authority": "verdictan-control-plane",
  "consistency": "repeatable-read-page",
  "observed_at": "2026-10-20 00:00:00+00",
  "requests": [{
    "request_id": "request-1",
    "policy": {"event_id": "event-1", "verdict": "allow", "reason_code": "policy.allowed", "policy_version": "version-1", "audit_state": "ingested"},
    "review": null,
    "review_authority": "account_broker",
    "usage": {"authorization_id": "55555555-5555-4555-8555-555555555555", "attempt_id": "66666666-6666-4666-8666-666666666666", "state": "active", "dispatch_state": "leased", "pricing_snapshot_id": "77777777-7777-4777-8777-777777777777", "provider": "openai", "model": "test-model", "estimated_cost": "0.0123", "actual_cost": null, "input_tokens": null, "output_tokens": null, "total_tokens": null, "currency": "USD", "source": "usage_authorization_ledger", "provider_charge": "not_reported"}
  }],
  "has_more": false,
  "next_cursor": null,
  "absence_means": "unknown_or_not_ingested",
  "replay_executes_requests": false
}
